{
  "schemaVersion": 1,
  "id": "slot-original-043",
  "title": "Neon Bazaar",
  "theme": {
    "accent": "#ff6ea9",
    "background": "#210c23",
    "panel": "#401639",
    "text": "#fff3f8"
  },
  "symbols": [
    {
      "id": "crown",
      "label": "♛ Crown",
      "color": "#ff6ea9",
      "kind": "regular"
    },
    {
      "id": "gem",
      "label": "◆ Gem",
      "color": "#210c23",
      "kind": "regular"
    },
    {
      "id": "star",
      "label": "★ Star",
      "color": "#ff6ea9",
      "kind": "regular"
    },
    {
      "id": "bell",
      "label": "● Bell",
      "color": "#210c23",
      "kind": "regular"
    },
    {
      "id": "moon",
      "label": "☾ Moon",
      "color": "#ff6ea9",
      "kind": "regular"
    },
    {
      "id": "spark",
      "label": "✦ Spark",
      "color": "#210c23",
      "kind": "regular"
    },
    {
      "id": "wild",
      "label": "W Wild",
      "color": "#ff6ea9",
      "kind": "wild"
    },
    {
      "id": "bonus",
      "label": "B Bonus",
      "color": "#210c23",
      "kind": "scatter"
    }
  ],
  "paytable": {
    "crown": [
      0,
      0,
      19,
      59,
      159
    ],
    "gem": [
      0,
      0,
      15,
      45,
      119
    ],
    "star": [
      0,
      0,
      11,
      34,
      93
    ],
    "bell": [
      0,
      0,
      10,
      29,
      81
    ],
    "moon": [
      0,
      0,
      8,
      24,
      66
    ],
    "spark": [
      0,
      0,
      6,
      19,
      53
    ],
    "wild": [
      0,
      0,
      29,
      90,
      240
    ],
    "bonus": [
      0,
      0,
      0,
      0,
      0
    ]
  },
  "reels": 5,
  "rows": 3,
  "lines": 10,
  "betOptions": [
    10,
    25,
    50,
    100,
    250
  ],
  "volatility": "low",
  "mathProfile": {
    "version": "1.1.0",
    "hitRate": 0.34,
    "weights": {
      "crown": 5,
      "gem": 7,
      "star": 10,
      "bell": 13,
      "moon": 17,
      "spark": 22,
      "wild": 3,
      "bonus": 2
    },
    "bonus": {
      "type": "free-spins",
      "triggerSymbol": "bonus",
      "triggerCount": 3,
      "freeSpins": 11,
      "multiplier": 1
    },
    "measuredRtp": 0.9491
  }
}
