{
  "schemaVersion": 1,
  "id": "slot-original-095",
  "title": "Stellar Garden",
  "theme": {
    "accent": "#5de2c2",
    "background": "#061d26",
    "panel": "#123747",
    "text": "#effffc"
  },
  "symbols": [
    {
      "id": "sun",
      "label": "☀ Sun",
      "color": "#5de2c2",
      "kind": "regular"
    },
    {
      "id": "wave",
      "label": "≋ Wave",
      "color": "#061d26",
      "kind": "regular"
    },
    {
      "id": "leaf",
      "label": "♣ Leaf",
      "color": "#5de2c2",
      "kind": "regular"
    },
    {
      "id": "pearl",
      "label": "○ Pearl",
      "color": "#061d26",
      "kind": "regular"
    },
    {
      "id": "kite",
      "label": "◇ Kite",
      "color": "#5de2c2",
      "kind": "regular"
    },
    {
      "id": "bloom",
      "label": "✿ Bloom",
      "color": "#061d26",
      "kind": "regular"
    },
    {
      "id": "wild",
      "label": "W Wild",
      "color": "#5de2c2",
      "kind": "wild"
    },
    {
      "id": "bonus",
      "label": "B Bonus",
      "color": "#061d26",
      "kind": "scatter"
    }
  ],
  "paytable": {
    "sun": [
      0,
      0,
      20,
      61,
      160
    ],
    "wave": [
      0,
      0,
      15,
      44,
      114
    ],
    "leaf": [
      0,
      0,
      11,
      34,
      87
    ],
    "pearl": [
      0,
      0,
      9,
      27,
      72
    ],
    "kite": [
      0,
      0,
      7,
      20,
      55
    ],
    "bloom": [
      0,
      0,
      6,
      17,
      46
    ],
    "wild": [
      0,
      0,
      28,
      81,
      223
    ],
    "bonus": [
      0,
      0,
      0,
      0,
      0
    ]
  },
  "reels": 5,
  "rows": 3,
  "lines": 10,
  "betOptions": [
    10,
    25,
    50,
    100,
    250
  ],
  "volatility": "medium",
  "mathProfile": {
    "version": "1.1.0",
    "hitRate": 0.27,
    "weights": {
      "sun": 4,
      "wave": 6,
      "leaf": 9,
      "pearl": 12,
      "kite": 16,
      "bloom": 21,
      "wild": 3,
      "bonus": 2
    },
    "bonus": {
      "type": "multiplier",
      "triggerSymbol": "bonus",
      "triggerCount": 3,
      "freeSpins": 0,
      "multiplier": 5
    },
    "measuredRtp": 0.9609
  }
}
