{
  "schemaVersion": 1,
  "id": "slot-original-015",
  "title": "Lucky Orchard",
  "theme": {
    "accent": "#5de2c2",
    "background": "#061d26",
    "panel": "#123747",
    "text": "#effffc"
  },
  "symbols": [
    {
      "id": "rocket",
      "label": "▲ Rocket",
      "color": "#5de2c2",
      "kind": "regular"
    },
    {
      "id": "planet",
      "label": "◉ Planet",
      "color": "#061d26",
      "kind": "regular"
    },
    {
      "id": "orbit",
      "label": "◎ Orbit",
      "color": "#5de2c2",
      "kind": "regular"
    },
    {
      "id": "nova",
      "label": "✷ Nova",
      "color": "#061d26",
      "kind": "regular"
    },
    {
      "id": "signal",
      "label": "⌁ Signal",
      "color": "#5de2c2",
      "kind": "regular"
    },
    {
      "id": "dust",
      "label": "✧ Dust",
      "color": "#061d26",
      "kind": "regular"
    },
    {
      "id": "wild",
      "label": "W Wild",
      "color": "#5de2c2",
      "kind": "wild"
    },
    {
      "id": "bonus",
      "label": "B Bonus",
      "color": "#061d26",
      "kind": "scatter"
    }
  ],
  "paytable": {
    "rocket": [
      0,
      0,
      27,
      84,
      220
    ],
    "planet": [
      0,
      0,
      20,
      59,
      161
    ],
    "orbit": [
      0,
      0,
      14,
      43,
      118
    ],
    "nova": [
      0,
      0,
      11,
      32,
      89
    ],
    "signal": [
      0,
      0,
      7,
      21,
      57
    ],
    "dust": [
      0,
      0,
      5,
      16,
      43
    ],
    "wild": [
      0,
      0,
      36,
      111,
      293
    ],
    "bonus": [
      0,
      0,
      0,
      0,
      0
    ]
  },
  "reels": 5,
  "rows": 3,
  "lines": 10,
  "betOptions": [
    10,
    25,
    50,
    100,
    250
  ],
  "volatility": "high",
  "mathProfile": {
    "version": "1.1.0",
    "hitRate": 0.19,
    "weights": {
      "rocket": 3,
      "planet": 5,
      "orbit": 8,
      "nova": 11,
      "signal": 15,
      "dust": 20,
      "wild": 2,
      "bonus": 1
    },
    "bonus": {
      "type": "respin",
      "triggerSymbol": "bonus",
      "triggerCount": 3,
      "freeSpins": 0,
      "multiplier": 1
    },
    "measuredRtp": 0.949
  }
}
