{
  "schemaVersion": 1,
  "id": "slot-original-100",
  "title": "Neon Harbor",
  "theme": {
    "accent": "#9cff6e",
    "background": "#071e19",
    "panel": "#153a2e",
    "text": "#f4fff0"
  },
  "symbols": [
    {
      "id": "crown",
      "label": "♛ Crown",
      "color": "#9cff6e",
      "kind": "regular"
    },
    {
      "id": "gem",
      "label": "◆ Gem",
      "color": "#071e19",
      "kind": "regular"
    },
    {
      "id": "star",
      "label": "★ Star",
      "color": "#9cff6e",
      "kind": "regular"
    },
    {
      "id": "bell",
      "label": "● Bell",
      "color": "#071e19",
      "kind": "regular"
    },
    {
      "id": "moon",
      "label": "☾ Moon",
      "color": "#9cff6e",
      "kind": "regular"
    },
    {
      "id": "spark",
      "label": "✦ Spark",
      "color": "#071e19",
      "kind": "regular"
    },
    {
      "id": "wild",
      "label": "W Wild",
      "color": "#9cff6e",
      "kind": "wild"
    },
    {
      "id": "bonus",
      "label": "B Bonus",
      "color": "#071e19",
      "kind": "scatter"
    }
  ],
  "paytable": {
    "crown": [
      0,
      0,
      20,
      58,
      155
    ],
    "gem": [
      0,
      0,
      15,
      44,
      116
    ],
    "star": [
      0,
      0,
      11,
      34,
      90
    ],
    "bell": [
      0,
      0,
      10,
      29,
      77
    ],
    "moon": [
      0,
      0,
      8,
      24,
      64
    ],
    "spark": [
      0,
      0,
      7,
      20,
      51
    ],
    "wild": [
      0,
      0,
      29,
      87,
      233
    ],
    "bonus": [
      0,
      0,
      0,
      0,
      0
    ]
  },
  "reels": 5,
  "rows": 3,
  "lines": 10,
  "betOptions": [
    10,
    25,
    50,
    100,
    250
  ],
  "volatility": "low",
  "mathProfile": {
    "version": "1.1.0",
    "hitRate": 0.34,
    "weights": {
      "crown": 5,
      "gem": 7,
      "star": 10,
      "bell": 13,
      "moon": 17,
      "spark": 22,
      "wild": 3,
      "bonus": 2
    },
    "bonus": {
      "type": "free-spins",
      "triggerSymbol": "bonus",
      "triggerCount": 3,
      "freeSpins": 8,
      "multiplier": 1
    },
    "measuredRtp": 0.9593
  }
}
