{
  "schemaVersion": 1,
  "id": "slot-original-036",
  "title": "Arctic Voyage",
  "theme": {
    "accent": "#9cff6e",
    "background": "#071e19",
    "panel": "#153a2e",
    "text": "#f4fff0"
  },
  "symbols": [
    {
      "id": "rocket",
      "label": "▲ Rocket",
      "color": "#9cff6e",
      "kind": "regular"
    },
    {
      "id": "planet",
      "label": "◉ Planet",
      "color": "#071e19",
      "kind": "regular"
    },
    {
      "id": "orbit",
      "label": "◎ Orbit",
      "color": "#9cff6e",
      "kind": "regular"
    },
    {
      "id": "nova",
      "label": "✷ Nova",
      "color": "#071e19",
      "kind": "regular"
    },
    {
      "id": "signal",
      "label": "⌁ Signal",
      "color": "#9cff6e",
      "kind": "regular"
    },
    {
      "id": "dust",
      "label": "✧ Dust",
      "color": "#071e19",
      "kind": "regular"
    },
    {
      "id": "wild",
      "label": "W Wild",
      "color": "#9cff6e",
      "kind": "wild"
    },
    {
      "id": "bonus",
      "label": "B Bonus",
      "color": "#071e19",
      "kind": "scatter"
    }
  ],
  "paytable": {
    "rocket": [
      0,
      0,
      26,
      80,
      212
    ],
    "planet": [
      0,
      0,
      19,
      58,
      156
    ],
    "orbit": [
      0,
      0,
      14,
      42,
      114
    ],
    "nova": [
      0,
      0,
      11,
      32,
      86
    ],
    "signal": [
      0,
      0,
      7,
      21,
      56
    ],
    "dust": [
      0,
      0,
      5,
      16,
      42
    ],
    "wild": [
      0,
      0,
      35,
      107,
      284
    ],
    "bonus": [
      0,
      0,
      0,
      0,
      0
    ]
  },
  "reels": 5,
  "rows": 3,
  "lines": 10,
  "betOptions": [
    10,
    25,
    50,
    100,
    250
  ],
  "volatility": "high",
  "mathProfile": {
    "version": "1.1.0",
    "hitRate": 0.19,
    "weights": {
      "rocket": 3,
      "planet": 5,
      "orbit": 8,
      "nova": 11,
      "signal": 15,
      "dust": 20,
      "wild": 2,
      "bonus": 1
    },
    "bonus": {
      "type": "respin",
      "triggerSymbol": "bonus",
      "triggerCount": 3,
      "freeSpins": 0,
      "multiplier": 1
    },
    "measuredRtp": 0.9491
  }
}
