{
  "schemaVersion": 1,
  "id": "slot-original-017",
  "title": "Arctic Orchard",
  "theme": {
    "accent": "#78f7ff",
    "background": "#071524",
    "panel": "#102940",
    "text": "#f5fbff"
  },
  "symbols": [
    {
      "id": "sun",
      "label": "☀ Sun",
      "color": "#78f7ff",
      "kind": "regular"
    },
    {
      "id": "wave",
      "label": "≋ Wave",
      "color": "#071524",
      "kind": "regular"
    },
    {
      "id": "leaf",
      "label": "♣ Leaf",
      "color": "#78f7ff",
      "kind": "regular"
    },
    {
      "id": "pearl",
      "label": "○ Pearl",
      "color": "#071524",
      "kind": "regular"
    },
    {
      "id": "kite",
      "label": "◇ Kite",
      "color": "#78f7ff",
      "kind": "regular"
    },
    {
      "id": "bloom",
      "label": "✿ Bloom",
      "color": "#071524",
      "kind": "regular"
    },
    {
      "id": "wild",
      "label": "W Wild",
      "color": "#78f7ff",
      "kind": "wild"
    },
    {
      "id": "bonus",
      "label": "B Bonus",
      "color": "#071524",
      "kind": "scatter"
    }
  ],
  "paytable": {
    "sun": [
      0,
      0,
      21,
      63,
      169
    ],
    "wave": [
      0,
      0,
      15,
      46,
      122
    ],
    "leaf": [
      0,
      0,
      12,
      35,
      94
    ],
    "pearl": [
      0,
      0,
      9,
      28,
      75
    ],
    "kite": [
      0,
      0,
      7,
      21,
      56
    ],
    "bloom": [
      0,
      0,
      6,
      18,
      47
    ],
    "wild": [
      0,
      0,
      29,
      88,
      234
    ],
    "bonus": [
      0,
      0,
      0,
      0,
      0
    ]
  },
  "reels": 5,
  "rows": 3,
  "lines": 10,
  "betOptions": [
    10,
    25,
    50,
    100,
    250
  ],
  "volatility": "medium",
  "mathProfile": {
    "version": "1.1.0",
    "hitRate": 0.27,
    "weights": {
      "sun": 4,
      "wave": 6,
      "leaf": 9,
      "pearl": 12,
      "kite": 16,
      "bloom": 21,
      "wild": 3,
      "bonus": 2
    },
    "bonus": {
      "type": "multiplier",
      "triggerSymbol": "bonus",
      "triggerCount": 3,
      "freeSpins": 0,
      "multiplier": 3
    },
    "measuredRtp": 0.9583
  }
}
