{
  "schemaVersion": 1,
  "id": "slot-original-083",
  "title": "Golden Garden",
  "theme": {
    "accent": "#ff6ea9",
    "background": "#210c23",
    "panel": "#401639",
    "text": "#fff3f8"
  },
  "symbols": [
    {
      "id": "sun",
      "label": "☀ Sun",
      "color": "#ff6ea9",
      "kind": "regular"
    },
    {
      "id": "wave",
      "label": "≋ Wave",
      "color": "#210c23",
      "kind": "regular"
    },
    {
      "id": "leaf",
      "label": "♣ Leaf",
      "color": "#ff6ea9",
      "kind": "regular"
    },
    {
      "id": "pearl",
      "label": "○ Pearl",
      "color": "#210c23",
      "kind": "regular"
    },
    {
      "id": "kite",
      "label": "◇ Kite",
      "color": "#ff6ea9",
      "kind": "regular"
    },
    {
      "id": "bloom",
      "label": "✿ Bloom",
      "color": "#210c23",
      "kind": "regular"
    },
    {
      "id": "wild",
      "label": "W Wild",
      "color": "#ff6ea9",
      "kind": "wild"
    },
    {
      "id": "bonus",
      "label": "B Bonus",
      "color": "#210c23",
      "kind": "scatter"
    }
  ],
  "paytable": {
    "sun": [
      0,
      0,
      21,
      62,
      162
    ],
    "wave": [
      0,
      0,
      15,
      45,
      116
    ],
    "leaf": [
      0,
      0,
      11,
      34,
      89
    ],
    "pearl": [
      0,
      0,
      9,
      28,
      73
    ],
    "kite": [
      0,
      0,
      7,
      21,
      55
    ],
    "bloom": [
      0,
      0,
      6,
      17,
      46
    ],
    "wild": [
      0,
      0,
      29,
      83,
      225
    ],
    "bonus": [
      0,
      0,
      0,
      0,
      0
    ]
  },
  "reels": 5,
  "rows": 3,
  "lines": 10,
  "betOptions": [
    10,
    25,
    50,
    100,
    250
  ],
  "volatility": "medium",
  "mathProfile": {
    "version": "1.1.0",
    "hitRate": 0.27,
    "weights": {
      "sun": 4,
      "wave": 6,
      "leaf": 9,
      "pearl": 12,
      "kite": 16,
      "bloom": 21,
      "wild": 3,
      "bonus": 2
    },
    "bonus": {
      "type": "multiplier",
      "triggerSymbol": "bonus",
      "triggerCount": 3,
      "freeSpins": 0,
      "multiplier": 5
    },
    "measuredRtp": 0.9609
  }
}
