{
  "schemaVersion": 1,
  "id": "slot-original-085",
  "title": "Ruby Garden",
  "theme": {
    "accent": "#a990ff",
    "background": "#100d2b",
    "panel": "#28205a",
    "text": "#f7f3ff"
  },
  "symbols": [
    {
      "id": "crown",
      "label": "♛ Crown",
      "color": "#a990ff",
      "kind": "regular"
    },
    {
      "id": "gem",
      "label": "◆ Gem",
      "color": "#100d2b",
      "kind": "regular"
    },
    {
      "id": "star",
      "label": "★ Star",
      "color": "#a990ff",
      "kind": "regular"
    },
    {
      "id": "bell",
      "label": "● Bell",
      "color": "#100d2b",
      "kind": "regular"
    },
    {
      "id": "moon",
      "label": "☾ Moon",
      "color": "#a990ff",
      "kind": "regular"
    },
    {
      "id": "spark",
      "label": "✦ Spark",
      "color": "#100d2b",
      "kind": "regular"
    },
    {
      "id": "wild",
      "label": "W Wild",
      "color": "#a990ff",
      "kind": "wild"
    },
    {
      "id": "bonus",
      "label": "B Bonus",
      "color": "#100d2b",
      "kind": "scatter"
    }
  ],
  "paytable": {
    "crown": [
      0,
      0,
      20,
      60,
      158
    ],
    "gem": [
      0,
      0,
      15,
      45,
      119
    ],
    "star": [
      0,
      0,
      12,
      35,
      92
    ],
    "bell": [
      0,
      0,
      10,
      30,
      79
    ],
    "moon": [
      0,
      0,
      8,
      25,
      66
    ],
    "spark": [
      0,
      0,
      7,
      20,
      53
    ],
    "wild": [
      0,
      0,
      30,
      89,
      237
    ],
    "bonus": [
      0,
      0,
      0,
      0,
      0
    ]
  },
  "reels": 5,
  "rows": 3,
  "lines": 10,
  "betOptions": [
    10,
    25,
    50,
    100,
    250
  ],
  "volatility": "low",
  "mathProfile": {
    "version": "1.1.0",
    "hitRate": 0.34,
    "weights": {
      "crown": 5,
      "gem": 7,
      "star": 10,
      "bell": 13,
      "moon": 17,
      "spark": 22,
      "wild": 3,
      "bonus": 2
    },
    "bonus": {
      "type": "free-spins",
      "triggerSymbol": "bonus",
      "triggerCount": 3,
      "freeSpins": 8,
      "multiplier": 1
    },
    "measuredRtp": 0.9608
  }
}
