{
  "schemaVersion": 1,
  "id": "slot-original-103",
  "title": "Silver Harbor",
  "theme": {
    "accent": "#5de2c2",
    "background": "#061d26",
    "panel": "#123747",
    "text": "#effffc"
  },
  "symbols": [
    {
      "id": "crown",
      "label": "♛ Crown",
      "color": "#5de2c2",
      "kind": "regular"
    },
    {
      "id": "gem",
      "label": "◆ Gem",
      "color": "#061d26",
      "kind": "regular"
    },
    {
      "id": "star",
      "label": "★ Star",
      "color": "#5de2c2",
      "kind": "regular"
    },
    {
      "id": "bell",
      "label": "● Bell",
      "color": "#061d26",
      "kind": "regular"
    },
    {
      "id": "moon",
      "label": "☾ Moon",
      "color": "#5de2c2",
      "kind": "regular"
    },
    {
      "id": "spark",
      "label": "✦ Spark",
      "color": "#061d26",
      "kind": "regular"
    },
    {
      "id": "wild",
      "label": "W Wild",
      "color": "#5de2c2",
      "kind": "wild"
    },
    {
      "id": "bonus",
      "label": "B Bonus",
      "color": "#061d26",
      "kind": "scatter"
    }
  ],
  "paytable": {
    "crown": [
      0,
      0,
      20,
      59,
      157
    ],
    "gem": [
      0,
      0,
      15,
      45,
      118
    ],
    "star": [
      0,
      0,
      12,
      35,
      92
    ],
    "bell": [
      0,
      0,
      10,
      30,
      78
    ],
    "moon": [
      0,
      0,
      8,
      25,
      65
    ],
    "spark": [
      0,
      0,
      7,
      20,
      52
    ],
    "wild": [
      0,
      0,
      30,
      88,
      236
    ],
    "bonus": [
      0,
      0,
      0,
      0,
      0
    ]
  },
  "reels": 5,
  "rows": 3,
  "lines": 10,
  "betOptions": [
    10,
    25,
    50,
    100,
    250
  ],
  "volatility": "low",
  "mathProfile": {
    "version": "1.1.0",
    "hitRate": 0.34,
    "weights": {
      "crown": 5,
      "gem": 7,
      "star": 10,
      "bell": 13,
      "moon": 17,
      "spark": 22,
      "wild": 3,
      "bonus": 2
    },
    "bonus": {
      "type": "free-spins",
      "triggerSymbol": "bonus",
      "triggerCount": 3,
      "freeSpins": 11,
      "multiplier": 1
    },
    "measuredRtp": 0.9595
  }
}
